hotel_name,rating,description,address,url,city,latitude,longitude
SELECT'soHOME - Appartement pour 4 personnes avec vue exceptionnelle - Piscine et garage privé - CAPNAT-B08,9.1,"SELECT'soHOME - Appartement pour 4 personnes avec vue exceptionnelle - Piscine et garage privé - CAPNAT-B08 in Bormes-les-Mimosas offers a spacious apartment with one bedroom, one bathroom, and a comfortable living room. Guests enjoy free WiFi and air-conditioning throughout the property.","1657 Route des Lavandières, 83230 Bormes-les-Mimosas, France",https://www.booking.com/hotel/fr/select-t2-avec-vue-piscine-et-parking-prive-capnat-b08.en-gb.html?aid=304142&label=gen173nr-10CAQoggJCGXNlYXJjaF9ib3JtZXMgbGVzIG1pbW9zYXNIM1gEaE2IAQGYATO4ARfIAQzYAQPoAQH4AQGIAgGoAgG4Aszxm9AGwAIB0gIkOTdkYTEyZjUtNWQxNi00ZWIxLWI4YzAtMmFhYTExYWFhN2Uz2AIB4AIB&sid=6a5a03abc590e516f802d74dc1773b96&dist=0&group_adults=2&group_children=0&hapos=25&hpos=25&no_rooms=1&req_adults=2&req_children=0&room1=A%2CA&sb_price_type=total&sr_order=popularity&srepoch=1778841806&srpvid=38324b66ab74008d&type=total&ucfs=1&,Bormes Les Mimosas,43.142718,6.352916
Chez Michel,9.3,Chez Michel in Marseille offers direct beachfront access with stunning sea views. Guests can relax on the sun terrace and enjoy the sunshine.,"Bat F 22 Chemin du Roucas Blanc, 13007 Marseille, France",https://www.booking.com/hotel/fr/chez-michel-marseille1.en-gb.html?aid=304142&label=gen173nr-10CAQoggJCEHNlYXJjaF9tYXJzZWlsbGVIM1gEaE2IAQGYATO4ARfIAQzYAQPoAQH4AQGIAgGoAgG4As_xm9AGwAIB0gIkOWJjNDI2ZmMtM2Y0OS00OWVjLThmZWEtOGJkNDEzMWQwMDY52AIB4AIB&sid=6a5a03abc590e516f802d74dc1773b96&dist=0&group_adults=2&group_children=0&hapos=25&hpos=25&no_rooms=1&req_adults=2&req_children=0&room1=A%2CA&sb_price_type=total&sr_order=popularity&srepoch=1778841809&srpvid=e9e04b6782ac001a&type=total&ucfs=1&,Marseille,43.2871464,5.3657881
Elana - Bel appartement dans la quartier du Camas,9.2,"Elana - Bel appartement dans la quartier du Camas in Marseille offers a 2-star apartment with one bedroom and a living room. The property includes a fully equipped kitchen, washing machine, and free WiFi.","65 rue abbé de l'épée, 13005 Marseille, France",https://www.booking.com/hotel/fr/elana-bel-appartement-dans-la-quartier-du-camas.en-gb.html?aid=304142&label=gen173nr-10CAQoggJCEHNlYXJjaF9tYXJzZWlsbGVIM1gEaE2IAQGYATO4ARfIAQzYAQPoAQH4AQGIAgGoAgG4As_xm9AGwAIB0gIkOWJjNDI2ZmMtM2Y0OS00OWVjLThmZWEtOGJkNDEzMWQwMDY52AIB4AIB&sid=6a5a03abc590e516f802d74dc1773b96&dist=0&group_adults=2&group_children=0&hapos=24&hpos=24&no_rooms=1&req_adults=2&req_children=0&room1=A%2CA&sb_price_type=total&sr_order=popularity&srepoch=1778841809&srpvid=e9e04b6782ac001a&type=total&ucfs=1&,Marseille,43.2971674,5.3912804
Studio Vieux-Port Marseille Quai Rive Neuve,9.0,"Studio Vieux-Port Marseille Quai Rive Neuve offers a recently renovated apartment in Marseille city centre. Guests enjoy free WiFi, a fully equipped kitchen, and a private bathroom with a walk-in shower.","6 6 Rue de la Croix, 13007 Marseille, France",https://www.booking.com/hotel/fr/studio-moderne-et-chaleureux-vieux-port-marseille.en-gb.html?aid=304142&label=gen173nr-10CAQoggJCEHNlYXJjaF9tYXJzZWlsbGVIM1gEaE2IAQGYATO4ARfIAQzYAQPoAQH4AQGIAgGoAgG4As_xm9AGwAIB0gIkOWJjNDI2ZmMtM2Y0OS00OWVjLThmZWEtOGJkNDEzMWQwMDY52AIB4AIB&sid=6a5a03abc590e516f802d74dc1773b96&dist=0&group_adults=2&group_children=0&hapos=23&hpos=23&no_rooms=1&req_adults=2&req_children=0&room1=A%2CA&sb_price_type=total&sr_order=popularity&srepoch=1778841809&srpvid=e9e04b6782ac001a&type=total&ucfs=1&,Marseille,43.2918258,5.3689631
studio idealement situé,10.0,"Studio idealement situé in Marseille offers free WiFi, a washing machine, a fully equipped kitchen, and a TV. The apartment includes one bedroom and one bathroom, ensuring comfort for all guests.","3 eme etage 32 Rue Tapis Vert, 13001 Marseille, France",https://www.booking.com/hotel/fr/studio-idealement-situe-marseille.en-gb.html?aid=304142&label=gen173nr-10CAQoggJCEHNlYXJjaF9tYXJzZWlsbGVIM1gEaE2IAQGYATO4ARfIAQzYAQPoAQH4AQGIAgGoAgG4As_xm9AGwAIB0gIkOWJjNDI2ZmMtM2Y0OS00OWVjLThmZWEtOGJkNDEzMWQwMDY52AIB4AIB&sid=6a5a03abc590e516f802d74dc1773b96&dist=0&group_adults=2&group_children=0&hapos=22&hpos=22&no_rooms=1&req_adults=2&req_children=0&room1=A%2CA&sb_price_type=total&sr_order=popularity&srepoch=1778841809&srpvid=e9e04b6782ac001a&type=total&ucfs=1&,Marseille,43.2983657,5.3786347
"appartement renové , quartier historique du panier , centre-ville",7.5,"The apartment is situated in Marseille city centre, less than 1 km from Joliette Metro Station and the Museum of Civilizations of Europe and the Mediterranean. Vieux Port Metro station is a 12-minute walk away, while Les Terrasses du Port Shopping Centre lies 1 km from the property. Marseille Saint-Charles Train Station is 1.4 km distant.","27 A RUE DU PANIER, 13002 Marseille, France",https://www.booking.com/hotel/fr/appart-renove-quartier-historique-centre-ville.en-gb.html?aid=304142&label=gen173nr-10CAQoggJCEHNlYXJjaF9tYXJzZWlsbGVIM1gEaE2IAQGYATO4ARfIAQzYAQPoAQH4AQGIAgGoAgG4As_xm9AGwAIB0gIkOWJjNDI2ZmMtM2Y0OS00OWVjLThmZWEtOGJkNDEzMWQwMDY52AIB4AIB&sid=6a5a03abc590e516f802d74dc1773b96&dist=0&group_adults=2&group_children=0&hapos=21&hpos=21&no_rooms=1&req_adults=2&req_children=0&room1=A%2CA&sb_price_type=total&sr_order=popularity&srepoch=1778841809&srpvid=e9e04b6782ac001a&type=total&ucfs=1&,Marseille,43.2995042728417,5.367907513804653
Campanile NATURE - Marseille Saint-Antoine,8.0,"This property is located a 10-minute drive from Marseille's Vieux Port, 1 km from l'Hôpital Nord and a 7-minute drive from Grand Littoral shopping centre. It offers air-conditioned accommodation with free Wi-Fi and a garden terrace.

Each room at the Campanile NATURE - Marseille Saint-Antoine is equipped with an LCD TV, cable channels and tea and coffee making facilities. Rooms also have a private bathroom.

A breakfast buffet of pastries and cold meat is served daily and the Campanile NATURE - Marseille Saint-Antoine Restaurant offers contemporary, French cuisine. You can also sample the starter and dessert buffet.

Free private parking are also available at this hotel.","59 Avenue Anne-Marie, 13015 Marseille, France",https://www.booking.com/hotel/fr/campanile-marseille-saint-antoine.en-gb.html?aid=304142&label=gen173nr-10CAQoggJCEHNlYXJjaF9tYXJzZWlsbGVIM1gEaE2IAQGYATO4ARfIAQzYAQPoAQH4AQGIAgGoAgG4As_xm9AGwAIB0gIkOWJjNDI2ZmMtM2Y0OS00OWVjLThmZWEtOGJkNDEzMWQwMDY52AIB4AIB&sid=6a5a03abc590e516f802d74dc1773b96&dist=0&group_adults=2&group_children=0&hapos=20&hpos=20&no_rooms=1&req_adults=2&req_children=0&room1=A%2CA&sb_price_type=total&sr_order=popularity&srepoch=1778841809&srpvid=e9e04b6782ac001a&type=total&ucfs=1&,Marseille,43.37978112199208,5.355641841888428
Ibis Marseille Centre Prefecture,7.3,"Located in the 6th district of Marseille, Ibis Marseille Centre Prefectureoffers free WiFi access and a 24-hour front desk. It is a 12-minute walk from the Vieux Port, and 3 km from the Velodrome Stadium.

Rooms at Ibis Marseille Centre Prefecturecan be accessed by an elevator and are equipped with a satellite TV, desk and wardrobe. Rooms have an en suite bathroom with a shower and toilet.

Breakfast is served daily for a supplement and guests can find restaurants, bars and shops nearby, the hotel also offers catering services for groups, upon request and subject to availability . Newspapers are available daily for guests.

Marseille Saint Charles Train Station is 1.5 km away and can be accessed by metro with two stops located within 350 metres of the hotel. Marseille Airport is 27 km away. Private underground parking is available for a supplement.

Secure private parking is available subject to availability and an additional charge of EUR 15 per night, payable on site. Please note that the maximum height is 1.90 meters.

Our hotel is labeled Green Key. An international label that certifies environmentally friendly tourist accommodation. Learn more, click this link: https://www.laclefverte.org/","13 Rue Lafon, Castellane et Préfecture, 13006 Marseille, France",https://www.booking.com/hotel/fr/premiere-classe-marseille-centre-xml.en-gb.html?aid=304142&label=gen173nr-10CAQoggJCEHNlYXJjaF9tYXJzZWlsbGVIM1gEaE2IAQGYATO4ARfIAQzYAQPoAQH4AQGIAgGoAgG4As_xm9AGwAIB0gIkOWJjNDI2ZmMtM2Y0OS00OWVjLThmZWEtOGJkNDEzMWQwMDY52AIB4AIB&sid=6a5a03abc590e516f802d74dc1773b96&dist=0&group_adults=2&group_children=0&hapos=19&hpos=19&no_rooms=1&req_adults=2&req_children=0&room1=A%2CA&sb_price_type=total&sr_order=popularity&srepoch=1778841809&srpvid=e9e04b6782ac001a&type=total&ucfs=1&,Marseille,43.291553228272214,5.381971076130867
"Superbe Appartement, vue Notre Dame de la Garde, Vieux port",9.3,"Superbe Appartement in Marseille offers a central position with stunning views of Notre Dame de la Garde and the Vieux Port. Plage des Catalans is 1.7 km away, while the Vieux Port Metro station is a 4-minute walk.","50 Quai du Port, 13002 Marseille, France",https://www.booking.com/hotel/fr/superbe-appartement-vue-notre-dame-de-la-garde-vieux-port.en-gb.html?aid=304142&label=gen173nr-10CAQoggJCEHNlYXJjaF9tYXJzZWlsbGVIM1gEaE2IAQGYATO4ARfIAQzYAQPoAQH4AQGIAgGoAgG4As_xm9AGwAIB0gIkOWJjNDI2ZmMtM2Y0OS00OWVjLThmZWEtOGJkNDEzMWQwMDY52AIB4AIB&sid=6a5a03abc590e516f802d74dc1773b96&dist=0&group_adults=2&group_children=0&hapos=18&hpos=18&no_rooms=1&req_adults=2&req_children=0&room1=A%2CA&sb_price_type=total&sr_order=popularity&srepoch=1778841809&srpvid=e9e04b6782ac001a&type=total&ucfs=1&,Marseille,43.2964589,5.3712229
Studio agreable au coeur du quartier historique,7.7,"Studio Agreable au Coeur du Quartier Historique in Marseille offers a convenient central location. Joliette Metro Station is less than 1 km away, while Vieux Port Metro station is an 11-minute walk. Les Terrasses du Port Shopping Centre lies 1 km from the apartment.","Numero A 2e etage 27 Rue du Panier, 13002 Marseille, France",https://www.booking.com/hotel/fr/studio-agreable-au-coeur-du-quartier-historique-marseille1.en-gb.html?aid=304142&label=gen173nr-10CAQoggJCEHNlYXJjaF9tYXJzZWlsbGVIM1gEaE2IAQGYATO4ARfIAQzYAQPoAQH4AQGIAgGoAgG4As_xm9AGwAIB0gIkOWJjNDI2ZmMtM2Y0OS00OWVjLThmZWEtOGJkNDEzMWQwMDY52AIB4AIB&sid=6a5a03abc590e516f802d74dc1773b96&dist=0&group_adults=2&group_children=0&hapos=17&hpos=17&no_rooms=1&req_adults=2&req_children=0&room1=A%2CA&sb_price_type=total&sr_order=popularity&srepoch=1778841809&srpvid=e9e04b6782ac001a&type=total&ucfs=1&,Marseille,43.299373766144,5.367903677085
PARADISE Earth & Sea,8.7,"PARADISE Earth & Sea in Marseille offers aparthotel-style accommodations with free WiFi, air-conditioning, and private bathrooms. Each unit includes a kitchenette, city views, and a balcony or terrace.","32 Rue Paradis, 13001 Marseille, France",https://www.booking.com/hotel/fr/paradise-eart-amp-sea.en-gb.html?aid=304142&label=gen173nr-10CAQoggJCEHNlYXJjaF9tYXJzZWlsbGVIM1gEaE2IAQGYATO4ARfIAQzYAQPoAQH4AQGIAgGoAgG4As_xm9AGwAIB0gIkOWJjNDI2ZmMtM2Y0OS00OWVjLThmZWEtOGJkNDEzMWQwMDY52AIB4AIB&sid=6a5a03abc590e516f802d74dc1773b96&dist=0&group_adults=2&group_children=0&hapos=16&hpos=16&no_rooms=1&req_adults=2&req_children=0&room1=A%2CA&sb_price_type=total&sr_order=popularity&srepoch=1778841809&srpvid=e9e04b6782ac001a&type=total&ucfs=1&,Marseille,43.2933693,5.376677
Appartement lumineux du Panier proche Cathedrale et MuCem,7.2,"The apartment offers streaming services, a washing machine, and a fully equipped kitchen with a refrigerator, microwave, electric kettle, and kitchenware. Additional features include a dining table, wardrobe, and free toiletries.","Rue Sainte-Françoise 11, 13002 Marseille, France",https://www.booking.com/hotel/fr/appartement-lumineux-du-panier-proche-cathedrale-et-mucem.en-gb.html?aid=304142&label=gen173nr-10CAQoggJCEHNlYXJjaF9tYXJzZWlsbGVIM1gEaE2IAQGYATO4ARfIAQzYAQPoAQH4AQGIAgGoAgG4As_xm9AGwAIB0gIkOWJjNDI2ZmMtM2Y0OS00OWVjLThmZWEtOGJkNDEzMWQwMDY52AIB4AIB&sid=6a5a03abc590e516f802d74dc1773b96&dist=0&group_adults=2&group_children=0&hapos=15&hpos=15&no_rooms=1&req_adults=2&req_children=0&room1=A%2CA&sb_price_type=total&sr_order=popularity&srepoch=1778841809&srpvid=e9e04b6782ac001a&type=total&ucfs=1&,Marseille,43.2979962,5.3661184
Novotel Marseille Centre Prado Vélodrome,8.0,"Novotel Marseille Centre Prado is located in one of Marseilles’ business districts. It is 50 metres from the Périer Metro Station providing access to all areas of the city, and 1.5 km from the Orange Velodrome Stadium.

Air-conditioned guest rooms feature a flat-screen TV with satellite channels and a mini-fridge. There are also facilities for making tea and coffee, and the bathrooms include a hairdryer and free toiletries. Free Wi-Fi access is provided.

The restaurant Novotel Café offers a menu of seasonal produce and daily specials featuring original and modern cuisine with a selection of salads, sandwiches, meals and desserts. Guests can have a professional meeting, or enjoy a glass of wine in the open space.

Centre de Congrès is 1 km away and the hotel is 2 km from the Old Port and La Canebière Boulevard; all of which are accessible by transit.

Marseille Saint-Charles Train Station is a 10-minute drive away and Marseille Airport is a 30-minute drive away. Marseille Chanot Exposition Centre is 1.2 km away. Paid public parking is available nearby with charging stations for electric cars available.","103, Avenue du Prado, 13008 Marseille, France",https://www.booking.com/hotel/fr/novotel-marseille-centre-prado.en-gb.html?aid=304142&label=gen173nr-10CAQoggJCEHNlYXJjaF9tYXJzZWlsbGVIM1gEaE2IAQGYATO4ARfIAQzYAQPoAQH4AQGIAgGoAgG4As_xm9AGwAIB0gIkOWJjNDI2ZmMtM2Y0OS00OWVjLThmZWEtOGJkNDEzMWQwMDY52AIB4AIB&sid=6a5a03abc590e516f802d74dc1773b96&dist=0&group_adults=2&group_children=0&hapos=14&hpos=14&no_rooms=1&req_adults=2&req_children=0&room1=A%2CA&sb_price_type=total&sr_order=popularity&srepoch=1778841809&srpvid=e9e04b6782ac001a&type=total&ucfs=1&,Marseille,43.28068115402996,5.387088060379028
Hotel Gambetta,3.7,"Hotel Gambetta in Marseille offers private bathrooms with city views, free toiletries, showers, TVs, and wardrobes. Each room ensures a pleasant stay with modern amenities.","49 Allée Léon Gambetta, 13001 Marseille, France",https://www.booking.com/hotel/fr/gambetta-marseille1.en-gb.html?aid=304142&label=gen173nr-10CAQoggJCEHNlYXJjaF9tYXJzZWlsbGVIM1gEaE2IAQGYATO4ARfIAQzYAQPoAQH4AQGIAgGoAgG4As_xm9AGwAIB0gIkOWJjNDI2ZmMtM2Y0OS00OWVjLThmZWEtOGJkNDEzMWQwMDY52AIB4AIB&sid=6a5a03abc590e516f802d74dc1773b96&dist=0&group_adults=2&group_children=0&hapos=13&hpos=13&no_rooms=1&req_adults=2&req_children=0&room1=A%2CA&sb_price_type=total&sr_order=popularity&srepoch=1778841809&srpvid=e9e04b6782ac001a&type=total&ucfs=1&,Marseille,43.2992907,5.3837702
Hôtel Amoi Vieux Port - Marseille,9.1,"Hôtel Amoi Vieux Port in Marseille offers family rooms with air-conditioning, private bathrooms, and free WiFi. Each room includes a work desk, TV, soundproofing, and wardrobe.","26 Rue Breteuil, Castellane et Préfecture, 13006 Marseille, France",https://www.booking.com/hotel/fr/amoi-vieux-port-marseille.en-gb.html?aid=304142&label=gen173nr-10CAQoggJCEHNlYXJjaF9tYXJzZWlsbGVIM1gEaE2IAQGYATO4ARfIAQzYAQPoAQH4AQGIAgGoAgG4As_xm9AGwAIB0gIkOWJjNDI2ZmMtM2Y0OS00OWVjLThmZWEtOGJkNDEzMWQwMDY52AIB4AIB&sid=6a5a03abc590e516f802d74dc1773b96&dist=0&group_adults=2&group_children=0&hapos=12&hpos=12&no_rooms=1&req_adults=2&req_children=0&room1=A%2CA&sb_price_type=total&sr_order=popularity&srepoch=1778841809&srpvid=e9e04b6782ac001a&type=total&ucfs=1&,Marseille,43.2898164291179,5.37592555079948
Hotel Belle-Vue Vieux-Port,8.5,"Located on Marseille Vieux Port, Hotel Belle-Vue Vieux-Port is an eco-friendly hotel offering views of the Notre-Dame de la Garde, Saint Jean Fort and Pharo Garden. Set in a typical Marseillaise building, it has a cocktail bar and an wrought-iron central staircase dating from 1900. Free WiFi access is available.

Please note that there is no elevator to access the front desk located on the first floor of the hotel.

Each room at the Hotel Belle-Vue is also equipped with air-conditioning and a flat-screen satellite TV, and most have large windows with views of the port. The private bathrooms have a hairdryer and either a shower or a bathtub. Ironing facilities are available.

A continental breakfast is provided daily and can be enjoyed in the guest rooms. The hotel’s restaurant serves traditional cuisine from the south of France. La Caravelle cocktail bar has a balcony where guests can enjoy a drink.

The 24-hour reception offers local tourist information and newspapers are available every morning.

Hotel Belle-Vue Vieux-Port is just 250 metres from the Vieux-Port Hotel de Ville Metro station, which provides direct access to the Saint Charles Train Station.","34, Quai du Port, 13002 Marseille, France",https://www.booking.com/hotel/fr/belle-vue.en-gb.html?aid=304142&label=gen173nr-10CAQoggJCEHNlYXJjaF9tYXJzZWlsbGVIM1gEaE2IAQGYATO4ARfIAQzYAQPoAQH4AQGIAgGoAgG4As_xm9AGwAIB0gIkOWJjNDI2ZmMtM2Y0OS00OWVjLThmZWEtOGJkNDEzMWQwMDY52AIB4AIB&sid=6a5a03abc590e516f802d74dc1773b96&dist=0&group_adults=2&group_children=0&hapos=11&hpos=11&no_rooms=1&req_adults=2&req_children=0&room1=A%2CA&sb_price_type=total&sr_order=popularity&srepoch=1778841809&srpvid=e9e04b6782ac001a&type=total&ucfs=1&,Marseille,43.29641559604076,5.372060984373093
HOTEL SYLVABELLE,5.2,"Hotel Sylvabelle in Marseille offers family rooms with private bathrooms, free toiletries, showers, TVs, and tiled floors. Each room includes a wardrobe for added convenience.","63 Rue Sylvabelle, Castellane et Préfecture, 13006 Marseille, France",https://www.booking.com/hotel/fr/sylvabelle-marseille12.en-gb.html?aid=304142&label=gen173nr-10CAQoggJCEHNlYXJjaF9tYXJzZWlsbGVIM1gEaE2IAQGYATO4ARfIAQzYAQPoAQH4AQGIAgGoAgG4As_xm9AGwAIB0gIkOWJjNDI2ZmMtM2Y0OS00OWVjLThmZWEtOGJkNDEzMWQwMDY52AIB4AIB&sid=6a5a03abc590e516f802d74dc1773b96&dist=0&group_adults=2&group_children=0&hapos=10&hpos=10&no_rooms=1&req_adults=2&req_children=0&room1=A%2CA&sb_price_type=total&sr_order=popularity&srepoch=1778841809&srpvid=e9e04b6782ac001a&type=total&ucfs=1&,Marseille,43.288849,5.377536
The Babel Community Hôtel - Vieux Port,8.4,"The Babel Community Hôtel - Vieux Port in Marseille offers a central position with a view. Plage des Catalans is 2 km away, while Vieux Port Metro station is a 5-minute walk. Saint-Ferreol Street lies 300 metres nearby.","21 Rue Haxo, 13001 Marseille, France",https://www.booking.com/hotel/fr/grand-t1-vieux-port-salle-de-sport-amp-rooftop.en-gb.html?aid=304142&label=gen173nr-10CAQoggJCEHNlYXJjaF9tYXJzZWlsbGVIM1gEaE2IAQGYATO4ARfIAQzYAQPoAQH4AQGIAgGoAgG4As_xm9AGwAIB0gIkOWJjNDI2ZmMtM2Y0OS00OWVjLThmZWEtOGJkNDEzMWQwMDY52AIB4AIB&sid=6a5a03abc590e516f802d74dc1773b96&dist=0&group_adults=2&group_children=0&hapos=9&hpos=9&no_rooms=1&req_adults=2&req_children=0&room1=A%2CA&sb_price_type=total&sr_order=popularity&srepoch=1778841809&srpvid=e9e04b6782ac001a&type=total&ucfs=1&,Marseille,43.2937579,5.3774478
RockyPop Marseille Hôtel,9.0,"RockyPop Marseille Hôtel in Marseille offers family rooms with air-conditioning, balconies, and free WiFi. Each room includes a private bathroom, soundproofing, and modern amenities.","60 Rue du Rouet, Castellane et Préfecture, 13006 Marseille, France",https://www.booking.com/hotel/fr/citadines-aparthotel-marseilleprado.en-gb.html?aid=304142&label=gen173nr-10CAQoggJCEHNlYXJjaF9tYXJzZWlsbGVIM1gEaE2IAQGYATO4ARfIAQzYAQPoAQH4AQGIAgGoAgG4As_xm9AGwAIB0gIkOWJjNDI2ZmMtM2Y0OS00OWVjLThmZWEtOGJkNDEzMWQwMDY52AIB4AIB&sid=6a5a03abc590e516f802d74dc1773b96&dist=0&group_adults=2&group_children=0&hapos=8&hpos=8&no_rooms=1&req_adults=2&req_children=0&room1=A%2CA&sb_price_type=total&sr_order=popularity&srepoch=1778841809&srpvid=e9e04b6782ac001a&type=total&ucfs=1&,Marseille,43.28282806447971,5.387259051203728
ibis budget Marseille Vieux Port,7.5,"Located in the heart of Marseille, ibis Budget Marseille Vieux Port offers a 14th-Century façade and a cocktail bar. The old port is just a 3-minute walk away and the train station is a 25-minute walk away.

All rooms are air-conditioned and feature a flat-screen TV with satellite channels, a desk, wardrobe and heating. The bathroom includes a shower and free toiletries.

A buffet breakfast is available each morning at ibis Budget Marseille Vieux Port and guests can also enjoy the bar on site. Restaurants are found within walking distance.

The beach is 1.6 km from the hotel and Marseille Opera is a 10-minute walk away. Additional features include luggage storage, a lift, free WiFi access and subject to availability.","46 Rue Sainte, 13001 Marseille, France",https://www.booking.com/hotel/fr/etap-marseille-vieux-port.en-gb.html?aid=304142&label=gen173nr-10CAQoggJCEHNlYXJjaF9tYXJzZWlsbGVIM1gEaE2IAQGYATO4ARfIAQzYAQPoAQH4AQGIAgGoAgG4As_xm9AGwAIB0gIkOWJjNDI2ZmMtM2Y0OS00OWVjLThmZWEtOGJkNDEzMWQwMDY52AIB4AIB&sid=6a5a03abc590e516f802d74dc1773b96&dist=0&group_adults=2&group_children=0&hapos=7&hpos=7&no_rooms=1&req_adults=2&req_children=0&room1=A%2CA&sb_price_type=total&sr_order=popularity&srepoch=1778841809&srpvid=e9e04b6782ac001a&type=total&ucfs=1&,Marseille,43.29220855923841,5.373554974794388
ibis Styles Marseille Palais des Congrès Vélodrome,8.6,"Located 1 km from the Orange Velodrome in South Marseille, the ibis Styles Marseille Velodrome Convention Center has air-conditioned rooms with free Wi-Fi, Canal+, and satellite TV.

The on-site restaurant serves a buffet breakfast and traditional French cuisine for lunch and dinner. Guests can relax in the evenings in the property’s spacious bar.

The property offers a 24-hour front desk and meeting facilities.

The ibis Styles Marseille Velodrome Convention Center is 3 km from Marsaille's Vieux Port and 2 km from the nearest beach. The hotel has a car park.","162 Boulevard Rabatau Daniel Matalon, 13010 Marseille, France",https://www.booking.com/hotel/fr/ibis-styles-marseille-palais-des-congres-velodrome.en-gb.html?aid=304142&label=gen173nr-10CAQoggJCEHNlYXJjaF9tYXJzZWlsbGVIM1gEaE2IAQGYATO4ARfIAQzYAQPoAQH4AQGIAgGoAgG4As_xm9AGwAIB0gIkOWJjNDI2ZmMtM2Y0OS00OWVjLThmZWEtOGJkNDEzMWQwMDY52AIB4AIB&sid=6a5a03abc590e516f802d74dc1773b96&dist=0&group_adults=2&group_children=0&hapos=6&hpos=6&no_rooms=1&req_adults=2&req_children=0&room1=A%2CA&sb_price_type=total&sr_order=popularity&srepoch=1778841809&srpvid=e9e04b6782ac001a&type=total&ucfs=1&,Marseille,43.28066065110931,5.399563014507294
Hôtel Maison Montgrand - Vieux Port,8.4,"Ideally located in the centre of Marseille, Hôtel Maison Montgrand - Vieux Port offers air-conditioned rooms, a garden, free WiFi and a terrace. The property has a bar, as well as a restaurant serving French cuisine. The accommodation provides room service, and luggage storage for guests.

All guest rooms in the hotel are equipped with a flat-screen TV. With a private bathroom fitted with a shower and free toiletries, some units at Hôtel Maison Montgrand - Vieux Port also have a city view. At the accommodation all rooms include bed linen and towels.

A continental, American or gluten-free breakfast can be enjoyed at the property.

Non-stop assistance is available at the reception, where staff speak Arabic, English, Spanish and French.

Popular points of interest near Hôtel Maison Montgrand - Vieux Port include Saint-Ferreol Street, Vieux Port Metro station and Castellane Metro Station. The nearest airport is Marseille Provence Airport, 23 km from the hotel.","35 Rue Montgrand, 13006 Marseille, France",https://www.booking.com/hotel/fr/montgrand.en-gb.html?aid=304142&label=gen173nr-10CAQoggJCEHNlYXJjaF9tYXJzZWlsbGVIM1gEaE2IAQGYATO4ARfIAQzYAQPoAQH4AQGIAgGoAgG4As_xm9AGwAIB0gIkOWJjNDI2ZmMtM2Y0OS00OWVjLThmZWEtOGJkNDEzMWQwMDY52AIB4AIB&sid=6a5a03abc590e516f802d74dc1773b96&dist=0&group_adults=2&group_children=0&hapos=5&hpos=5&no_rooms=1&req_adults=2&req_children=0&room1=A%2CA&sb_price_type=total&sr_order=popularity&srepoch=1778841809&srpvid=e9e04b6782ac001a&type=total&ucfs=1&,Marseille,43.2909627,5.376429199999961
«Entre Terre et Mer » 5mins à pied Plage/15mins Vieux Port,7.0,"The apartment offers two bedrooms and a living room with a sofa. Guests enjoy free WiFi, streaming services, and a washing machine. The kitchen is equipped with a refrigerator, microwave, dishwasher, oven, and electric kettle.","50 Rue Sauveur Tobelem, 13007 Marseille, France",https://www.booking.com/hotel/fr/entre-terre-et-mer-5mins-a-pied-plage-15mins-vieux-port.en-gb.html?aid=304142&label=gen173nr-10CAQoggJCEHNlYXJjaF9tYXJzZWlsbGVIM1gEaE2IAQGYATO4ARfIAQzYAQPoAQH4AQGIAgGoAgG4As_xm9AGwAIB0gIkOWJjNDI2ZmMtM2Y0OS00OWVjLThmZWEtOGJkNDEzMWQwMDY52AIB4AIB&sid=6a5a03abc590e516f802d74dc1773b96&dist=0&group_adults=2&group_children=0&hapos=4&hpos=4&no_rooms=1&req_adults=2&req_children=0&room1=A%2CA&sb_price_type=total&sr_order=popularity&srepoch=1778841809&srpvid=e9e04b6782ac001a&type=total&ucfs=1&,Marseille,43.2873935,5.3609536
MEININGER Marseille Centre la Joliette,8.5,"MEININGER Marseille Centre la Joliette in Marseille offers family rooms with air-conditioning, private bathrooms, and city views. Each room includes a seating area, free toiletries, and soundproofing.","25/27 Rue de Forbin, 13002 Marseille, France",https://www.booking.com/hotel/fr/meininger-marseille-centre-la-joliette.en-gb.html?aid=304142&label=gen173nr-10CAQoggJCEHNlYXJjaF9tYXJzZWlsbGVIM1gEaE2IAQGYATO4ARfIAQzYAQPoAQH4AQGIAgGoAgG4As_xm9AGwAIB0gIkOWJjNDI2ZmMtM2Y0OS00OWVjLThmZWEtOGJkNDEzMWQwMDY52AIB4AIB&sid=6a5a03abc590e516f802d74dc1773b96&dist=0&group_adults=2&group_children=0&hapos=3&hpos=3&no_rooms=1&req_adults=2&req_children=0&room1=A%2CA&sb_price_type=total&sr_order=popularity&srepoch=1778841809&srpvid=e9e04b6782ac001a&type=total&ucfs=1&,Marseille,43.30574814984538,5.371058398811321
